{
  "last_entered_phase": "EXECUTE_ANALYZE",
  "iteration": 1,
  "run_id": "frontier-44-nous3-s2",
  "family": null,
  "timestamp": "2026-10-01T05:21:12.453366+00:00",
  "config_ref": null,
  "work_dir": "/Users/toslali/frontier/gen_logs/nous_runs/frontier-44-nous3-s2",
  "repo_path": "/Users/toslali/frontier/gen_logs/frontier_44_nous3-s2_ws",
  "reproducibility_metadata": {
    "captured_at": "2026-10-01T05:16:48Z",
    "repo_commit": "a2cd0594925cfbeaa049d7174ccf663182f637c2",
    "repo_dirty": false,
    "language_versions": {
      "python": "Python 3.11.7",
      "go": "go version go1.24.0 darwin/arm64",
      "node": "v25.2.1",
      "rust": "rustc 1.93.1 (01f6ddf75 2026-02-11) (Homebrew)"
    }
  },
  "max_iterations": 3
}
